{
 "archiveRepo": "https://github.com/Markus-web/lobbaan-archive",
 "changes": {
  "added": 83,
  "edited": 1,
  "removed": 2
 },
 "date": "2025-02-04",
 "generatedAt": "2026-10-29T10:08:31.456Z",
 "sources": [
  {
   "bytes": 8036976,
   "fetchedAt": "2025-02-04T00:00:00.000Z",
   "note": "Imported from the Internet Archive capture 20250204100139 (web.archive.org).",
   "ok": true,
   "partial": false,
   "records": 1245,
   "sha256": "dd098aa0266edae96a1b4d3136307b16a46a94fe252bc85e6f66f1b3560e9cbd",
   "snapshotKey": "imports/wayback-20250204100139/activity-notification.json.gz",
   "source": "activity-notification",
   "url": "https://public.api.avoimuusrekisteri.fi/open-data-activity-notification"
  }
 ]
}
