{
 "archiveRepo": "https://github.com/Markus-web/lobbaan-archive",
 "changes": {
  "added": 1
 },
 "date": "2026-10-29",
 "generatedAt": "2026-10-29T14:05:20.087Z",
 "sources": [
  {
   "bytes": 1361950,
   "fetchedAt": "2026-10-29T14:05:20.087Z",
   "httpStatus": 200,
   "ok": true,
   "records": 1382,
   "sha256": "2c4605f34e9bfc7a5c0f67045feb349b09bfbc37f29c54f7fa53e93e3dad1bf1",
   "snapshotKey": "snapshots/2026-10-29/register-notification.json.gz",
   "source": "register-notification",
   "url": "https://public.api.avoimuusrekisteri.fi/open-data-register-notification"
  },
  {
   "error": "HTTP 500",
   "fetchedAt": "2026-10-29T14:05:33.333Z",
   "httpStatus": 500,
   "note": "Fetch failed; previous versions kept, no removals inferred.",
   "ok": false,
   "partial": true,
   "source": "activity-notification",
   "url": "https://public.api.avoimuusrekisteri.fi/open-data-activity-notification"
  },
  {
   "bytes": 59281,
   "fetchedAt": "2026-10-29T14:06:02.767Z",
   "httpStatus": 200,
   "ok": true,
   "records": 81,
   "sha256": "b179caab4ca661194388fe557537eeabb0c1791fbba306c49e26c8875d998db1",
   "snapshotKey": "snapshots/2026-10-29/exit-notification.json.gz",
   "source": "exit-notification",
   "url": "https://public.api.avoimuusrekisteri.fi/open-data-exit-notification"
  },
  {
   "bytes": 2,
   "fetchedAt": "2026-10-29T14:06:05.883Z",
   "httpStatus": 200,
   "note": "Implausibly few records; removals not inferred.",
   "ok": true,
   "partial": true,
   "records": 0,
   "sha256": "4f53cda18c2baa0c0354bb5f9a3ecbe5ed12ab4d8e11ba873c2f11161202b945",
   "snapshotKey": "snapshots/2026-10-29/penalty-payments.json.gz",
   "source": "penalty-payments",
   "url": "https://public.api.avoimuusrekisteri.fi/open-data-penalty-payments"
  },
  {
   "bytes": 1744,
   "fetchedAt": "2026-10-29T14:06:06.050Z",
   "httpStatus": 200,
   "ok": true,
   "records": 6,
   "sha256": "f9d2a83c7f770b75b84fecbddfb5b9702d8fccce52042a3735aef985dd517a83",
   "snapshotKey": "snapshots/2026-10-29/term.json.gz",
   "source": "term",
   "url": "https://public.api.avoimuusrekisteri.fi/open-data-term"
  },
  {
   "bytes": 2962096,
   "fetchedAt": "2026-10-29T14:06:06.214Z",
   "httpStatus": 200,
   "ok": true,
   "records": 4550,
   "sha256": "48da9a1aee70d8d842b5e2cb3b3f5b84441c1a2fd28cb46289aca12e3b5278cd",
   "snapshotKey": "snapshots/2026-10-29/targets.json.gz",
   "source": "targets",
   "url": "https://public.api.avoimuusrekisteri.fi/open-data-target/targets"
  },
  {
   "error": "HTTP 403",
   "fetchedAt": "2026-10-29T14:06:08.301Z",
   "ok": false,
   "partial": true,
   "records": 0,
   "source": "kansalaisaloite-initiatives",
   "url": "https://www.kansalaisaloite.fi/api/v1/initiatives"
  },
  {
   "fetchedAt": "2026-10-29T14:08:58.318Z",
   "note": "Rotating refresh: 200 of 1371 business IDs, 0 failed.",
   "ok": true,
   "partial": true,
   "records": 82,
   "source": "prh-ytj",
   "url": "https://avoindata.prh.fi/opendata-ytj-api/v3"
  }
 ]
}
