{
 "archiveRepo": "https://github.com/Markus-web/lobbaan-archive",
 "changes": {},
 "date": "2025-01-22",
 "generatedAt": "2026-10-29T10:08:31.244Z",
 "sources": [
  {
   "bytes": 7342207,
   "fetchedAt": "2025-01-22T00:00:00.000Z",
   "note": "Imported from the Internet Archive capture 20250122184438 (web.archive.org).",
   "ok": true,
   "partial": false,
   "records": 1164,
   "sha256": "c5ac702c01c947e3c3f2b6195f06725bc558e9d076e1b4483d5595bf8b84a545",
   "snapshotKey": "imports/wayback-20250122184438/activity-notification.json.gz",
   "source": "activity-notification",
   "url": "https://public.api.avoimuusrekisteri.fi/open-data-activity-notification"
  }
 ]
}
